No.     Time           Source                Destination           Protocol Length Info
      1 0.000000000    10.214.10.1           10.255.150.114        RTCP     74     Receiver Report   Source description   

Frame 1: 74 bytes on wire (592 bits), 74 bytes captured (592 bits) on interface 0
Ethernet II, Src: HewlettP_2d:df:4c (d0:7e:28:2d:df:4c), Dst: 26:39:3e:b9:6c:69 (26:39:3e:b9:6c:69)
Internet Protocol Version 4, Src: 10.214.10.1, Dst: 10.255.150.114
User Datagram Protocol, Src Port: 8001, Dst Port: 11875
Real-time Transport Control Protocol (Receiver Report)
Real-time Transport Control Protocol (Source description)

No.     Time           Source                Destination           Protocol Length Info
      2 0.000177665    10.214.10.1           10.255.150.114        SIP/SDP  711    Status: 200 OK | 

Frame 2: 711 bytes on wire (5688 bits), 711 bytes captured (5688 bits) on interface 0
Ethernet II, Src: HewlettP_2d:df:4c (d0:7e:28:2d:df:4c), Dst: 26:39:3e:b9:6c:69 (26:39:3e:b9:6c:69)
Internet Protocol Version 4, Src: 10.214.10.1, Dst: 10.255.150.114
User Datagram Protocol, Src Port: 5060, Dst Port: 5060
Session Initiation Protocol (200)

No.     Time           Source                Destination           Protocol Length Info
      3 0.001406024    10.255.150.114        10.214.10.1           SIP      426    Request: ACK sip:62@10.214.10.1 | 

Frame 3: 426 bytes on wire (3408 bits), 426 bytes captured (3408 bits) on interface 0
Ethernet II, Src: 26:39:3e:b9:6c:69 (26:39:3e:b9:6c:69), Dst: HewlettP_2d:df:4c (d0:7e:28:2d:df:4c)
Internet Protocol Version 4, Src: 10.255.150.114, Dst: 10.214.10.1
User Datagram Protocol, Src Port: 5060, Dst Port: 5060
Session Initiation Protocol (ACK)

No.     Time           Source                Destination           Protocol Length Info
      4 0.001913833    10.255.150.114        10.214.9.1            SSH      238    Server: Encrypted packet (len=172)

Frame 4: 238 bytes on wire (1904 bits), 238 bytes captured (1904 bits) on interface 0
Ethernet II, Src: 26:39:3e:b9:6c:69 (26:39:3e:b9:6c:69), Dst: HewlettP_2d:df:4c (d0:7e:28:2d:df:4c)
Internet Protocol Version 4, Src: 10.255.150.114, Dst: 10.214.9.1
Transmission Control Protocol, Src Port: 22, Dst Port: 47524, Seq: 1, Ack: 1, Len: 172
SSH Protocol

No.     Time           Source                Destination           Protocol Length Info
      5 0.002858367    10.255.150.114        10.214.9.1            SIP/SDP  794    Status: 200 OK | 

Frame 5: 794 bytes on wire (6352 bits), 794 bytes captured (6352 bits) on interface 0
Ethernet II, Src: 26:39:3e:b9:6c:69 (26:39:3e:b9:6c:69), Dst: HewlettP_2d:df:4c (d0:7e:28:2d:df:4c)
Internet Protocol Version 4, Src: 10.255.150.114, Dst: 10.214.9.1
User Datagram Protocol, Src Port: 5060, Dst Port: 5060
Session Initiation Protocol (200)

No.     Time           Source                Destination           Protocol Length Info
      6 0.003046777    10.214.9.1            10.255.150.114        TCP      66     47524 → 22 [ACK] Seq=1 Ack=173 Win=1444 Len=0 TSval=3237479719 TSecr=149607645

Frame 6: 66 bytes on wire (528 bits), 66 bytes captured (528 bits) on interface 0
Ethernet II, Src: HewlettP_2d:df:4c (d0:7e:28:2d:df:4c), Dst: 26:39:3e:b9:6c:69 (26:39:3e:b9:6c:69)
Internet Protocol Version 4, Src: 10.214.9.1, Dst: 10.255.150.114
Transmission Control Protocol, Src Port: 47524, Dst Port: 22, Seq: 1, Ack: 173, Len: 0

No.     Time           Source                Destination           Protocol Length Info
      7 0.004277984    10.255.150.114        10.214.9.1            SSH      198    Server: Encrypted packet (len=132)

Frame 7: 198 bytes on wire (1584 bits), 198 bytes captured (1584 bits) on interface 0
Ethernet II, Src: 26:39:3e:b9:6c:69 (26:39:3e:b9:6c:69), Dst: HewlettP_2d:df:4c (d0:7e:28:2d:df:4c)
Internet Protocol Version 4, Src: 10.255.150.114, Dst: 10.214.9.1
Transmission Control Protocol, Src Port: 22, Dst Port: 47524, Seq: 173, Ack: 1, Len: 132
SSH Protocol

No.     Time           Source                Destination           Protocol Length Info
      8 0.005348896    10.214.9.1            10.255.150.114        TCP      66     47524 → 22 [ACK] Seq=1 Ack=305 Win=1444 Len=0 TSval=3237479721 TSecr=149607646

Frame 8: 66 bytes on wire (528 bits), 66 bytes captured (528 bits) on interface 0
Ethernet II, Src: HewlettP_2d:df:4c (d0:7e:28:2d:df:4c), Dst: 26:39:3e:b9:6c:69 (26:39:3e:b9:6c:69)
Internet Protocol Version 4, Src: 10.214.9.1, Dst: 10.255.150.114
Transmission Control Protocol, Src Port: 47524, Dst Port: 22, Seq: 1, Ack: 305, Len: 0

No.     Time           Source                Destination           Protocol Length Info
      9 0.005458618    10.255.150.114        10.214.9.1            SSH      254    Server: Encrypted packet (len=188)

Frame 9: 254 bytes on wire (2032 bits), 254 bytes captured (2032 bits) on interface 0
Ethernet II, Src: 26:39:3e:b9:6c:69 (26:39:3e:b9:6c:69), Dst: HewlettP_2d:df:4c (d0:7e:28:2d:df:4c)
Internet Protocol Version 4, Src: 10.255.150.114, Dst: 10.214.9.1
Transmission Control Protocol, Src Port: 22, Dst Port: 47524, Seq: 305, Ack: 1, Len: 188
SSH Protocol

No.     Time           Source                Destination           Protocol Length Info
     10 0.006452994    10.214.9.1            10.255.150.114        TCP      66     47524 → 22 [ACK] Seq=1 Ack=493 Win=1444 Len=0 TSval=3237479722 TSecr=149607646

Frame 10: 66 bytes on wire (528 bits), 66 bytes captured (528 bits) on interface 0
Ethernet II, Src: HewlettP_2d:df:4c (d0:7e:28:2d:df:4c), Dst: 26:39:3e:b9:6c:69 (26:39:3e:b9:6c:69)
Internet Protocol Version 4, Src: 10.214.9.1, Dst: 10.255.150.114
Transmission Control Protocol, Src Port: 47524, Dst Port: 22, Seq: 1, Ack: 493, Len: 0

No.     Time           Source                Destination           Protocol Length Info
     11 0.006545855    10.255.150.114        10.214.10.1           SIP/SDP  834    Request: INVITE sip:62@10.214.10.1, in-dialog | 

Frame 11: 834 bytes on wire (6672 bits), 834 bytes captured (6672 bits) on interface 0
Ethernet II, Src: 26:39:3e:b9:6c:69 (26:39:3e:b9:6c:69), Dst: HewlettP_2d:df:4c (d0:7e:28:2d:df:4c)
Internet Protocol Version 4, Src: 10.255.150.114, Dst: 10.214.10.1
User Datagram Protocol, Src Port: 5060, Dst Port: 5060
Session Initiation Protocol (INVITE)

No.     Time           Source                Destination           Protocol Length Info
     12 0.007276513    10.214.10.1           10.255.150.114        SIP/SDP  711    Status: 200 OK | 

Frame 12: 711 bytes on wire (5688 bits), 711 bytes captured (5688 bits) on interface 0
Ethernet II, Src: HewlettP_2d:df:4c (d0:7e:28:2d:df:4c), Dst: 26:39:3e:b9:6c:69 (26:39:3e:b9:6c:69)
Internet Protocol Version 4, Src: 10.214.10.1, Dst: 10.255.150.114
User Datagram Protocol, Src Port: 5060, Dst Port: 5060
Session Initiation Protocol (200)

No.     Time           Source                Destination           Protocol Length Info
     13 0.008212642    10.255.150.114        10.214.10.1           SIP      426    Request: ACK sip:62@10.214.10.1 | 

Frame 13: 426 bytes on wire (3408 bits), 426 bytes captured (3408 bits) on interface 0
Ethernet II, Src: 26:39:3e:b9:6c:69 (26:39:3e:b9:6c:69), Dst: HewlettP_2d:df:4c (d0:7e:28:2d:df:4c)
Internet Protocol Version 4, Src: 10.255.150.114, Dst: 10.214.10.1
User Datagram Protocol, Src Port: 5060, Dst Port: 5060
Session Initiation Protocol (ACK)

No.     Time           Source                Destination           Protocol Length Info
     14 0.008591759    10.255.150.114        10.214.9.1            SSH      606    Server: Encrypted packet (len=540)

Frame 14: 606 bytes on wire (4848 bits), 606 bytes captured (4848 bits) on interface 0
Ethernet II, Src: 26:39:3e:b9:6c:69 (26:39:3e:b9:6c:69), Dst: HewlettP_2d:df:4c (d0:7e:28:2d:df:4c)
Internet Protocol Version 4, Src: 10.255.150.114, Dst: 10.214.9.1
Transmission Control Protocol, Src Port: 22, Dst Port: 47524, Seq: 493, Ack: 1, Len: 540
SSH Protocol

No.     Time           Source                Destination           Protocol Length Info
     15 0.008868428    10.255.150.114        10.214.9.1            SSH      238    Server: Encrypted packet (len=172)

Frame 15: 238 bytes on wire (1904 bits), 238 bytes captured (1904 bits) on interface 0
Ethernet II, Src: 26:39:3e:b9:6c:69 (26:39:3e:b9:6c:69), Dst: HewlettP_2d:df:4c (d0:7e:28:2d:df:4c)
Internet Protocol Version 4, Src: 10.255.150.114, Dst: 10.214.9.1
Transmission Control Protocol, Src Port: 22, Dst Port: 47524, Seq: 1033, Ack: 1, Len: 172
SSH Protocol

No.     Time           Source                Destination           Protocol Length Info
     16 0.010425930    10.214.9.1            10.255.150.114        TCP      66     47524 → 22 [ACK] Seq=1 Ack=1033 Win=1444 Len=0 TSval=3237479726 TSecr=149607647

Frame 16: 66 bytes on wire (528 bits), 66 bytes captured (528 bits) on interface 0
Ethernet II, Src: HewlettP_2d:df:4c (d0:7e:28:2d:df:4c), Dst: 26:39:3e:b9:6c:69 (26:39:3e:b9:6c:69)
Internet Protocol Version 4, Src: 10.214.9.1, Dst: 10.255.150.114
Transmission Control Protocol, Src Port: 47524, Dst Port: 22, Seq: 1, Ack: 1033, Len: 0

No.     Time           Source                Destination           Protocol Length Info
     17 0.010441734    10.214.9.1            10.255.150.114        TCP      66     47524 → 22 [ACK] Seq=1 Ack=1205 Win=1444 Len=0 TSval=3237479726 TSecr=149607647

Frame 17: 66 bytes on wire (528 bits), 66 bytes captured (528 bits) on interface 0
Ethernet II, Src: HewlettP_2d:df:4c (d0:7e:28:2d:df:4c), Dst: 26:39:3e:b9:6c:69 (26:39:3e:b9:6c:69)
Internet Protocol Version 4, Src: 10.214.9.1, Dst: 10.255.150.114
Transmission Control Protocol, Src Port: 47524, Dst Port: 22, Seq: 1, Ack: 1205, Len: 0

No.     Time           Source                Destination           Protocol Length Info
     18 0.027845657    10.214.9.1            10.255.150.114        RTCP     74     Receiver Report   Source description   

Frame 18: 74 bytes on wire (592 bits), 74 bytes captured (592 bits) on interface 0
Ethernet II, Src: HewlettP_2d:df:4c (d0:7e:28:2d:df:4c), Dst: 26:39:3e:b9:6c:69 (26:39:3e:b9:6c:69)
Internet Protocol Version 4, Src: 10.214.9.1, Dst: 10.255.150.114
User Datagram Protocol, Src Port: 8001, Dst Port: 12333
Real-time Transport Control Protocol (Receiver Report)
Real-time Transport Control Protocol (Source description)

No.     Time           Source                Destination           Protocol Length Info
     19 0.027881078    10.255.150.114        10.214.9.1            ICMP     102    Destination unreachable (Port unreachable)

Frame 19: 102 bytes on wire (816 bits), 102 bytes captured (816 bits) on interface 0
Ethernet II, Src: 26:39:3e:b9:6c:69 (26:39:3e:b9:6c:69), Dst: HewlettP_2d:df:4c (d0:7e:28:2d:df:4c)
Internet Protocol Version 4, Src: 10.255.150.114, Dst: 10.214.9.1
Internet Control Message Protocol

No.     Time           Source                Destination           Protocol Length Info
     20 0.028636537    10.214.9.1            10.255.150.114        SIP      501    Request: ACK sip:62@10.255.150.114:5060 | 

Frame 20: 501 bytes on wire (4008 bits), 501 bytes captured (4008 bits) on interface 0
Ethernet II, Src: HewlettP_2d:df:4c (d0:7e:28:2d:df:4c), Dst: 26:39:3e:b9:6c:69 (26:39:3e:b9:6c:69)
Internet Protocol Version 4, Src: 10.214.9.1, Dst: 10.255.150.114
User Datagram Protocol, Src Port: 5060, Dst Port: 5060
Session Initiation Protocol (ACK)

No.     Time           Source                Destination           Protocol Length Info
     21 0.028876943    10.255.150.114        10.214.9.1            SIP/SDP  811    Request: INVITE sip:61@10.214.9.1, in-dialog | 

Frame 21: 811 bytes on wire (6488 bits), 811 bytes captured (6488 bits) on interface 0
Ethernet II, Src: 26:39:3e:b9:6c:69 (26:39:3e:b9:6c:69), Dst: HewlettP_2d:df:4c (d0:7e:28:2d:df:4c)
Internet Protocol Version 4, Src: 10.255.150.114, Dst: 10.214.9.1
User Datagram Protocol, Src Port: 5060, Dst Port: 5060
Session Initiation Protocol (INVITE)

No.     Time           Source                Destination           Protocol Length Info
     22 0.032310773    10.214.10.1           10.255.150.114        RTCP     86     Receiver Report   Goodbye   

Frame 22: 86 bytes on wire (688 bits), 86 bytes captured (688 bits) on interface 0
Ethernet II, Src: HewlettP_2d:df:4c (d0:7e:28:2d:df:4c), Dst: 26:39:3e:b9:6c:69 (26:39:3e:b9:6c:69)
Internet Protocol Version 4, Src: 10.214.10.1, Dst: 10.255.150.114
User Datagram Protocol, Src Port: 8001, Dst Port: 11875
Real-time Transport Control Protocol (Receiver Report)
Real-time Transport Control Protocol (Goodbye)

No.     Time           Source                Destination           Protocol Length Info
     23 0.032326454    10.214.9.1            10.255.150.114        SIP/SDP  717    Status: 200 OK | 

Frame 23: 717 bytes on wire (5736 bits), 717 bytes captured (5736 bits) on interface 0
Ethernet II, Src: HewlettP_2d:df:4c (d0:7e:28:2d:df:4c), Dst: 26:39:3e:b9:6c:69 (26:39:3e:b9:6c:69)
Internet Protocol Version 4, Src: 10.214.9.1, Dst: 10.255.150.114
User Datagram Protocol, Src Port: 5060, Dst Port: 5060
Session Initiation Protocol (200)

No.     Time           Source                Destination           Protocol Length Info
     24 0.032785097    10.255.150.114        10.214.9.1            SIP      403    Request: ACK sip:61@10.214.9.1 | 

Frame 24: 403 bytes on wire (3224 bits), 403 bytes captured (3224 bits) on interface 0
Ethernet II, Src: 26:39:3e:b9:6c:69 (26:39:3e:b9:6c:69), Dst: HewlettP_2d:df:4c (d0:7e:28:2d:df:4c)
Internet Protocol Version 4, Src: 10.255.150.114, Dst: 10.214.9.1
User Datagram Protocol, Src Port: 5060, Dst Port: 5060
Session Initiation Protocol (ACK)

No.     Time           Source                Destination           Protocol Length Info
     25 0.033062124    10.255.150.114        10.214.9.1            SSH      238    Server: Encrypted packet (len=172)

Frame 25: 238 bytes on wire (1904 bits), 238 bytes captured (1904 bits) on interface 0
Ethernet II, Src: 26:39:3e:b9:6c:69 (26:39:3e:b9:6c:69), Dst: HewlettP_2d:df:4c (d0:7e:28:2d:df:4c)
Internet Protocol Version 4, Src: 10.255.150.114, Dst: 10.214.9.1
Transmission Control Protocol, Src Port: 22, Dst Port: 47524, Seq: 1205, Ack: 1, Len: 172
SSH Protocol

No.     Time           Source                Destination           Protocol Length Info
     26 0.034376286    10.214.9.1            10.255.150.114        TCP      66     47524 → 22 [ACK] Seq=1 Ack=1377 Win=1444 Len=0 TSval=3237479750 TSecr=149607653

Frame 26: 66 bytes on wire (528 bits), 66 bytes captured (528 bits) on interface 0
Ethernet II, Src: HewlettP_2d:df:4c (d0:7e:28:2d:df:4c), Dst: 26:39:3e:b9:6c:69 (26:39:3e:b9:6c:69)
Internet Protocol Version 4, Src: 10.214.9.1, Dst: 10.255.150.114
Transmission Control Protocol, Src Port: 47524, Dst Port: 22, Seq: 1, Ack: 1377, Len: 0

No.     Time           Source                Destination           Protocol Length Info
     27 0.068188590    10.214.9.1            10.255.150.114        RTCP     86     Receiver Report   Goodbye   

Frame 27: 86 bytes on wire (688 bits), 86 bytes captured (688 bits) on interface 0
Ethernet II, Src: HewlettP_2d:df:4c (d0:7e:28:2d:df:4c), Dst: 26:39:3e:b9:6c:69 (26:39:3e:b9:6c:69)
Internet Protocol Version 4, Src: 10.214.9.1, Dst: 10.255.150.114
User Datagram Protocol, Src Port: 8001, Dst Port: 12333
Real-time Transport Control Protocol (Receiver Report)
Real-time Transport Control Protocol (Goodbye)

No.     Time           Source                Destination           Protocol Length Info
     28 0.434627713    10.255.150.114        10.214.10.1           SSH      110    Server: Encrypted packet (len=44)

Frame 28: 110 bytes on wire (880 bits), 110 bytes captured (880 bits) on interface 0
Ethernet II, Src: 26:39:3e:b9:6c:69 (26:39:3e:b9:6c:69), Dst: HewlettP_2d:df:4c (d0:7e:28:2d:df:4c)
Internet Protocol Version 4, Src: 10.255.150.114, Dst: 10.214.10.1
Transmission Control Protocol, Src Port: 22, Dst Port: 49336, Seq: 1, Ack: 1, Len: 44
SSH Protocol

No.     Time           Source                Destination           Protocol Length Info
     29 0.435167510    10.214.10.1           10.255.150.114        TCP      66     49336 → 22 [ACK] Seq=1 Ack=45 Win=296 Len=0 TSval=3233217622 TSecr=149607753

Frame 29: 66 bytes on wire (528 bits), 66 bytes captured (528 bits) on interface 0
Ethernet II, Src: HewlettP_2d:df:4c (d0:7e:28:2d:df:4c), Dst: 26:39:3e:b9:6c:69 (26:39:3e:b9:6c:69)
Internet Protocol Version 4, Src: 10.214.10.1, Dst: 10.255.150.114
Transmission Control Protocol, Src Port: 49336, Dst Port: 22, Seq: 1, Ack: 45, Len: 0

No.     Time           Source                Destination           Protocol Length Info
     30 0.940736076    10.255.150.114        10.214.10.1           SSH      110    Server: Encrypted packet (len=44)

Frame 30: 110 bytes on wire (880 bits), 110 bytes captured (880 bits) on interface 0
Ethernet II, Src: 26:39:3e:b9:6c:69 (26:39:3e:b9:6c:69), Dst: HewlettP_2d:df:4c (d0:7e:28:2d:df:4c)
Internet Protocol Version 4, Src: 10.255.150.114, Dst: 10.214.10.1
Transmission Control Protocol, Src Port: 22, Dst Port: 49336, Seq: 45, Ack: 1, Len: 44
SSH Protocol

No.     Time           Source                Destination           Protocol Length Info
     31 0.941107493    10.214.10.1           10.255.150.114        TCP      66     49336 → 22 [ACK] Seq=1 Ack=89 Win=296 Len=0 TSval=3233218128 TSecr=149607880

Frame 31: 66 bytes on wire (528 bits), 66 bytes captured (528 bits) on interface 0
Ethernet II, Src: HewlettP_2d:df:4c (d0:7e:28:2d:df:4c), Dst: 26:39:3e:b9:6c:69 (26:39:3e:b9:6c:69)
Internet Protocol Version 4, Src: 10.214.10.1, Dst: 10.255.150.114
Transmission Control Protocol, Src Port: 49336, Dst Port: 22, Seq: 1, Ack: 89, Len: 0

No.     Time           Source                Destination           Protocol Length Info
     32 1.452624055    10.255.150.114        10.214.10.1           SSH      110    Server: Encrypted packet (len=44)

Frame 32: 110 bytes on wire (880 bits), 110 bytes captured (880 bits) on interface 0
Ethernet II, Src: 26:39:3e:b9:6c:69 (26:39:3e:b9:6c:69), Dst: HewlettP_2d:df:4c (d0:7e:28:2d:df:4c)
Internet Protocol Version 4, Src: 10.255.150.114, Dst: 10.214.10.1
Transmission Control Protocol, Src Port: 22, Dst Port: 49336, Seq: 89, Ack: 1, Len: 44
SSH Protocol

No.     Time           Source                Destination           Protocol Length Info
     33 1.453211984    10.214.10.1           10.255.150.114        TCP      66     49336 → 22 [ACK] Seq=1 Ack=133 Win=296 Len=0 TSval=3233218640 TSecr=149608008

Frame 33: 66 bytes on wire (528 bits), 66 bytes captured (528 bits) on interface 0
Ethernet II, Src: HewlettP_2d:df:4c (d0:7e:28:2d:df:4c), Dst: 26:39:3e:b9:6c:69 (26:39:3e:b9:6c:69)
Internet Protocol Version 4, Src: 10.214.10.1, Dst: 10.255.150.114
Transmission Control Protocol, Src Port: 49336, Dst Port: 22, Seq: 1, Ack: 133, Len: 0

No.     Time           Source                Destination           Protocol Length Info
     34 1.964600312    10.255.150.114        10.214.10.1           SSH      110    Server: Encrypted packet (len=44)

Frame 34: 110 bytes on wire (880 bits), 110 bytes captured (880 bits) on interface 0
Ethernet II, Src: 26:39:3e:b9:6c:69 (26:39:3e:b9:6c:69), Dst: HewlettP_2d:df:4c (d0:7e:28:2d:df:4c)
Internet Protocol Version 4, Src: 10.255.150.114, Dst: 10.214.10.1
Transmission Control Protocol, Src Port: 22, Dst Port: 49336, Seq: 133, Ack: 1, Len: 44
SSH Protocol

No.     Time           Source                Destination           Protocol Length Info
     35 1.965032242    10.214.10.1           10.255.150.114        TCP      66     49336 → 22 [ACK] Seq=1 Ack=177 Win=296 Len=0 TSval=3233219152 TSecr=149608136

Frame 35: 66 bytes on wire (528 bits), 66 bytes captured (528 bits) on interface 0
Ethernet II, Src: HewlettP_2d:df:4c (d0:7e:28:2d:df:4c), Dst: 26:39:3e:b9:6c:69 (26:39:3e:b9:6c:69)
Internet Protocol Version 4, Src: 10.214.10.1, Dst: 10.255.150.114
Transmission Control Protocol, Src Port: 49336, Dst Port: 22, Seq: 1, Ack: 177, Len: 0

No.     Time           Source                Destination           Protocol Length Info
     36 2.476524026    10.255.150.114        10.214.10.1           SSH      110    Server: Encrypted packet (len=44)

Frame 36: 110 bytes on wire (880 bits), 110 bytes captured (880 bits) on interface 0
Ethernet II, Src: 26:39:3e:b9:6c:69 (26:39:3e:b9:6c:69), Dst: HewlettP_2d:df:4c (d0:7e:28:2d:df:4c)
Internet Protocol Version 4, Src: 10.255.150.114, Dst: 10.214.10.1
Transmission Control Protocol, Src Port: 22, Dst Port: 49336, Seq: 177, Ack: 1, Len: 44
SSH Protocol

No.     Time           Source                Destination           Protocol Length Info
     37 2.477067797    10.214.10.1           10.255.150.114        TCP      66     49336 → 22 [ACK] Seq=1 Ack=221 Win=296 Len=0 TSval=3233219664 TSecr=149608264

Frame 37: 66 bytes on wire (528 bits), 66 bytes captured (528 bits) on interface 0
Ethernet II, Src: HewlettP_2d:df:4c (d0:7e:28:2d:df:4c), Dst: 26:39:3e:b9:6c:69 (26:39:3e:b9:6c:69)
Internet Protocol Version 4, Src: 10.214.10.1, Dst: 10.255.150.114
Transmission Control Protocol, Src Port: 49336, Dst Port: 22, Seq: 1, Ack: 221, Len: 0

No.     Time           Source                Destination           Protocol Length Info
     38 2.532370102    10.214.9.1            10.255.150.114        SIP      344    Request: BYE sip:62@10.255.150.114:5060 | 

Frame 38: 344 bytes on wire (2752 bits), 344 bytes captured (2752 bits) on interface 0
Ethernet II, Src: HewlettP_2d:df:4c (d0:7e:28:2d:df:4c), Dst: 26:39:3e:b9:6c:69 (26:39:3e:b9:6c:69)
Internet Protocol Version 4, Src: 10.214.9.1, Dst: 10.255.150.114
User Datagram Protocol, Src Port: 5060, Dst Port: 5060
Session Initiation Protocol (BYE)

No.     Time           Source                Destination           Protocol Length Info
     39 2.533498588    10.255.150.114        10.214.9.1            SIP      463    Status: 200 OK | 

Frame 39: 463 bytes on wire (3704 bits), 463 bytes captured (3704 bits) on interface 0
Ethernet II, Src: 26:39:3e:b9:6c:69 (26:39:3e:b9:6c:69), Dst: HewlettP_2d:df:4c (d0:7e:28:2d:df:4c)
Internet Protocol Version 4, Src: 10.255.150.114, Dst: 10.214.9.1
User Datagram Protocol, Src Port: 5060, Dst Port: 5060
Session Initiation Protocol (200)

No.     Time           Source                Destination           Protocol Length Info
     40 2.534474187    10.255.150.114        10.214.10.1           SIP/SDP  843    Request: INVITE sip:62@10.214.10.1, in-dialog | 

Frame 40: 843 bytes on wire (6744 bits), 843 bytes captured (6744 bits) on interface 0
Ethernet II, Src: 26:39:3e:b9:6c:69 (26:39:3e:b9:6c:69), Dst: HewlettP_2d:df:4c (d0:7e:28:2d:df:4c)
Internet Protocol Version 4, Src: 10.255.150.114, Dst: 10.214.10.1
User Datagram Protocol, Src Port: 5060, Dst Port: 5060
Session Initiation Protocol (INVITE)

No.     Time           Source                Destination           Protocol Length Info
     41 2.535891188    10.255.150.114        10.214.9.1            SSH      334    Server: Encrypted packet (len=268)

Frame 41: 334 bytes on wire (2672 bits), 334 bytes captured (2672 bits) on interface 0
Ethernet II, Src: 26:39:3e:b9:6c:69 (26:39:3e:b9:6c:69), Dst: HewlettP_2d:df:4c (d0:7e:28:2d:df:4c)
Internet Protocol Version 4, Src: 10.255.150.114, Dst: 10.214.9.1
Transmission Control Protocol, Src Port: 22, Dst Port: 47524, Seq: 1377, Ack: 1, Len: 268
SSH Protocol

No.     Time           Source                Destination           Protocol Length Info
     42 2.536661651    10.214.10.1           10.255.150.114        SIP/SDP  711    Status: 200 OK | 

Frame 42: 711 bytes on wire (5688 bits), 711 bytes captured (5688 bits) on interface 0
Ethernet II, Src: HewlettP_2d:df:4c (d0:7e:28:2d:df:4c), Dst: 26:39:3e:b9:6c:69 (26:39:3e:b9:6c:69)
Internet Protocol Version 4, Src: 10.214.10.1, Dst: 10.255.150.114
User Datagram Protocol, Src Port: 5060, Dst Port: 5060
Session Initiation Protocol (200)

No.     Time           Source                Destination           Protocol Length Info
     43 2.536882587    10.255.150.114        10.214.9.1            SSH      246    Server: Encrypted packet (len=180)

Frame 43: 246 bytes on wire (1968 bits), 246 bytes captured (1968 bits) on interface 0
Ethernet II, Src: 26:39:3e:b9:6c:69 (26:39:3e:b9:6c:69), Dst: HewlettP_2d:df:4c (d0:7e:28:2d:df:4c)
Internet Protocol Version 4, Src: 10.255.150.114, Dst: 10.214.9.1
Transmission Control Protocol, Src Port: 22, Dst Port: 47524, Seq: 1645, Ack: 1, Len: 180
SSH Protocol

No.     Time           Source                Destination           Protocol Length Info
     44 2.537128087    10.214.9.1            10.255.150.114        TCP      66     47524 → 22 [ACK] Seq=1 Ack=1645 Win=1444 Len=0 TSval=3237482253 TSecr=149608279

Frame 44: 66 bytes on wire (528 bits), 66 bytes captured (528 bits) on interface 0
Ethernet II, Src: HewlettP_2d:df:4c (d0:7e:28:2d:df:4c), Dst: 26:39:3e:b9:6c:69 (26:39:3e:b9:6c:69)
Internet Protocol Version 4, Src: 10.214.9.1, Dst: 10.255.150.114
Transmission Control Protocol, Src Port: 47524, Dst Port: 22, Seq: 1, Ack: 1645, Len: 0

No.     Time           Source                Destination           Protocol Length Info
     45 2.538206313    10.214.9.1            10.255.150.114        TCP      66     47524 → 22 [ACK] Seq=1 Ack=1825 Win=1444 Len=0 TSval=3237482254 TSecr=149608279

Frame 45: 66 bytes on wire (528 bits), 66 bytes captured (528 bits) on interface 0
Ethernet II, Src: HewlettP_2d:df:4c (d0:7e:28:2d:df:4c), Dst: 26:39:3e:b9:6c:69 (26:39:3e:b9:6c:69)
Internet Protocol Version 4, Src: 10.214.9.1, Dst: 10.255.150.114
Transmission Control Protocol, Src Port: 47524, Dst Port: 22, Seq: 1, Ack: 1825, Len: 0

No.     Time           Source                Destination           Protocol Length Info
     46 2.538426404    10.255.150.114        10.214.9.1            SSH      238    Server: Encrypted packet (len=172)

Frame 46: 238 bytes on wire (1904 bits), 238 bytes captured (1904 bits) on interface 0
Ethernet II, Src: 26:39:3e:b9:6c:69 (26:39:3e:b9:6c:69), Dst: HewlettP_2d:df:4c (d0:7e:28:2d:df:4c)
Internet Protocol Version 4, Src: 10.255.150.114, Dst: 10.214.9.1
Transmission Control Protocol, Src Port: 22, Dst Port: 47524, Seq: 1825, Ack: 1, Len: 172
SSH Protocol

No.     Time           Source                Destination           Protocol Length Info
     47 2.538570758    10.255.150.114        10.214.10.1           SIP      426    Request: ACK sip:62@10.214.10.1 | 

Frame 47: 426 bytes on wire (3408 bits), 426 bytes captured (3408 bits) on interface 0
Ethernet II, Src: 26:39:3e:b9:6c:69 (26:39:3e:b9:6c:69), Dst: HewlettP_2d:df:4c (d0:7e:28:2d:df:4c)
Internet Protocol Version 4, Src: 10.255.150.114, Dst: 10.214.10.1
User Datagram Protocol, Src Port: 5060, Dst Port: 5060
Session Initiation Protocol (ACK)

No.     Time           Source                Destination           Protocol Length Info
     48 2.538673739    10.255.150.114        10.214.10.1           SIP      460    Request: BYE sip:62@10.214.10.1 | 

Frame 48: 460 bytes on wire (3680 bits), 460 bytes captured (3680 bits) on interface 0
Ethernet II, Src: 26:39:3e:b9:6c:69 (26:39:3e:b9:6c:69), Dst: HewlettP_2d:df:4c (d0:7e:28:2d:df:4c)
Internet Protocol Version 4, Src: 10.255.150.114, Dst: 10.214.10.1
User Datagram Protocol, Src Port: 5060, Dst Port: 5060
Session Initiation Protocol (BYE)

No.     Time           Source                Destination           Protocol Length Info
     49 2.539395852    10.214.9.1            10.255.150.114        TCP      66     47524 → 22 [ACK] Seq=1 Ack=1997 Win=1444 Len=0 TSval=3237482255 TSecr=149608279

Frame 49: 66 bytes on wire (528 bits), 66 bytes captured (528 bits) on interface 0
Ethernet II, Src: HewlettP_2d:df:4c (d0:7e:28:2d:df:4c), Dst: 26:39:3e:b9:6c:69 (26:39:3e:b9:6c:69)
Internet Protocol Version 4, Src: 10.214.9.1, Dst: 10.255.150.114
Transmission Control Protocol, Src Port: 47524, Dst Port: 22, Seq: 1, Ack: 1997, Len: 0

No.     Time           Source                Destination           Protocol Length Info
     50 2.575025568    10.214.10.1           10.255.150.114        SIP      329    Status: 200 OK | 

Frame 50: 329 bytes on wire (2632 bits), 329 bytes captured (2632 bits) on interface 0
Ethernet II, Src: HewlettP_2d:df:4c (d0:7e:28:2d:df:4c), Dst: 26:39:3e:b9:6c:69 (26:39:3e:b9:6c:69)
Internet Protocol Version 4, Src: 10.214.10.1, Dst: 10.255.150.114
User Datagram Protocol, Src Port: 5060, Dst Port: 5060
Session Initiation Protocol (200)

No.     Time           Source                Destination           Protocol Length Info
     51 2.994353469    10.255.150.114        10.214.10.1           SSH      110    Server: Encrypted packet (len=44)

Frame 51: 110 bytes on wire (880 bits), 110 bytes captured (880 bits) on interface 0
Ethernet II, Src: 26:39:3e:b9:6c:69 (26:39:3e:b9:6c:69), Dst: HewlettP_2d:df:4c (d0:7e:28:2d:df:4c)
Internet Protocol Version 4, Src: 10.255.150.114, Dst: 10.214.10.1
Transmission Control Protocol, Src Port: 22, Dst Port: 49336, Seq: 221, Ack: 1, Len: 44
SSH Protocol

No.     Time           Source                Destination           Protocol Length Info
     52 2.994921800    10.214.10.1           10.255.150.114        TCP      66     49336 → 22 [ACK] Seq=1 Ack=265 Win=296 Len=0 TSval=3233220182 TSecr=149608393

Frame 52: 66 bytes on wire (528 bits), 66 bytes captured (528 bits) on interface 0
Ethernet II, Src: HewlettP_2d:df:4c (d0:7e:28:2d:df:4c), Dst: 26:39:3e:b9:6c:69 (26:39:3e:b9:6c:69)
Internet Protocol Version 4, Src: 10.214.10.1, Dst: 10.255.150.114
Transmission Control Protocol, Src Port: 49336, Dst Port: 22, Seq: 1, Ack: 265, Len: 0

No.     Time           Source                Destination           Protocol Length Info
     53 3.470372002    Dell_6b:af:88         26:39:3e:b9:6c:69     ARP      60     Who has 10.255.150.114? Tell 10.255.255.200

Frame 53: 60 bytes on wire (480 bits), 60 bytes captured (480 bits) on interface 0
Ethernet II, Src: Dell_6b:af:88 (14:18:77:6b:af:88), Dst: 26:39:3e:b9:6c:69 (26:39:3e:b9:6c:69)
Address Resolution Protocol (request)

No.     Time           Source                Destination           Protocol Length Info
     54 3.470400687    26:39:3e:b9:6c:69     Dell_6b:af:88         ARP      42     10.255.150.114 is at 26:39:3e:b9:6c:69

Frame 54: 42 bytes on wire (336 bits), 42 bytes captured (336 bits) on interface 0
Ethernet II, Src: 26:39:3e:b9:6c:69 (26:39:3e:b9:6c:69), Dst: Dell_6b:af:88 (14:18:77:6b:af:88)
Address Resolution Protocol (reply)

No.     Time           Source                Destination           Protocol Length Info
     55 3.500783511    10.255.150.114        10.214.10.1           SSH      110    Server: Encrypted packet (len=44)

Frame 55: 110 bytes on wire (880 bits), 110 bytes captured (880 bits) on interface 0
Ethernet II, Src: 26:39:3e:b9:6c:69 (26:39:3e:b9:6c:69), Dst: HewlettP_2d:df:4c (d0:7e:28:2d:df:4c)
Internet Protocol Version 4, Src: 10.255.150.114, Dst: 10.214.10.1
Transmission Control Protocol, Src Port: 22, Dst Port: 49336, Seq: 265, Ack: 1, Len: 44
SSH Protocol

No.     Time           Source                Destination           Protocol Length Info
     56 3.501363309    10.214.10.1           10.255.150.114        TCP      66     49336 → 22 [ACK] Seq=1 Ack=309 Win=296 Len=0 TSval=3233220688 TSecr=149608520

Frame 56: 66 bytes on wire (528 bits), 66 bytes captured (528 bits) on interface 0
Ethernet II, Src: HewlettP_2d:df:4c (d0:7e:28:2d:df:4c), Dst: 26:39:3e:b9:6c:69 (26:39:3e:b9:6c:69)
Internet Protocol Version 4, Src: 10.214.10.1, Dst: 10.255.150.114
Transmission Control Protocol, Src Port: 49336, Dst Port: 22, Seq: 1, Ack: 309, Len: 0

No.     Time           Source                Destination           Protocol Length Info
     57 3.723563154    26:39:3e:b9:6c:69     Dell_6b:af:88         ARP      42     Who has 10.255.255.200? Tell 10.255.150.114

Frame 57: 42 bytes on wire (336 bits), 42 bytes captured (336 bits) on interface 0
Ethernet II, Src: 26:39:3e:b9:6c:69 (26:39:3e:b9:6c:69), Dst: Dell_6b:af:88 (14:18:77:6b:af:88)
Address Resolution Protocol (request)

No.     Time           Source                Destination           Protocol Length Info
     58 3.724065207    Dell_6b:af:88         26:39:3e:b9:6c:69     ARP      60     10.255.255.200 is at 14:18:77:6b:af:88

Frame 58: 60 bytes on wire (480 bits), 60 bytes captured (480 bits) on interface 0
Ethernet II, Src: Dell_6b:af:88 (14:18:77:6b:af:88), Dst: 26:39:3e:b9:6c:69 (26:39:3e:b9:6c:69)
Address Resolution Protocol (reply)

No.     Time           Source                Destination           Protocol Length Info
     59 4.018386845    10.255.150.114        10.214.10.1           SSH      110    Server: Encrypted packet (len=44)

Frame 59: 110 bytes on wire (880 bits), 110 bytes captured (880 bits) on interface 0
Ethernet II, Src: 26:39:3e:b9:6c:69 (26:39:3e:b9:6c:69), Dst: HewlettP_2d:df:4c (d0:7e:28:2d:df:4c)
Internet Protocol Version 4, Src: 10.255.150.114, Dst: 10.214.10.1
Transmission Control Protocol, Src Port: 22, Dst Port: 49336, Seq: 309, Ack: 1, Len: 44
SSH Protocol

No.     Time           Source                Destination           Protocol Length Info
     60 4.018874108    10.214.10.1           10.255.150.114        TCP      66     49336 → 22 [ACK] Seq=1 Ack=353 Win=296 Len=0 TSval=3233221206 TSecr=149608649

Frame 60: 66 bytes on wire (528 bits), 66 bytes captured (528 bits) on interface 0
Ethernet II, Src: HewlettP_2d:df:4c (d0:7e:28:2d:df:4c), Dst: 26:39:3e:b9:6c:69 (26:39:3e:b9:6c:69)
Internet Protocol Version 4, Src: 10.214.10.1, Dst: 10.255.150.114
Transmission Control Protocol, Src Port: 49336, Dst Port: 22, Seq: 1, Ack: 353, Len: 0

No.     Time           Source                Destination           Protocol Length Info
     61 4.524687711    10.255.150.114        10.214.10.1           SSH      110    Server: Encrypted packet (len=44)

Frame 61: 110 bytes on wire (880 bits), 110 bytes captured (880 bits) on interface 0
Ethernet II, Src: 26:39:3e:b9:6c:69 (26:39:3e:b9:6c:69), Dst: HewlettP_2d:df:4c (d0:7e:28:2d:df:4c)
Internet Protocol Version 4, Src: 10.255.150.114, Dst: 10.214.10.1
Transmission Control Protocol, Src Port: 22, Dst Port: 49336, Seq: 353, Ack: 1, Len: 44
SSH Protocol

No.     Time           Source                Destination           Protocol Length Info
     62 4.525235866    10.214.10.1           10.255.150.114        TCP      66     49336 → 22 [ACK] Seq=1 Ack=397 Win=296 Len=0 TSval=3233221712 TSecr=149608776

Frame 62: 66 bytes on wire (528 bits), 66 bytes captured (528 bits) on interface 0
Ethernet II, Src: HewlettP_2d:df:4c (d0:7e:28:2d:df:4c), Dst: 26:39:3e:b9:6c:69 (26:39:3e:b9:6c:69)
Internet Protocol Version 4, Src: 10.214.10.1, Dst: 10.255.150.114
Transmission Control Protocol, Src Port: 49336, Dst Port: 22, Seq: 1, Ack: 397, Len: 0
