No.     Time           Source                Destination           Protocol Length Info
      1 0.000000000    10.213.2.101          10.213.2.1            ICMP     100    Echo (ping) request  id=0x2bea, seq=1/256, ttl=64 (reply in 2)

Frame 1: 100 bytes on wire (800 bits), 100 bytes captured (800 bits) on interface 0
Linux cooked capture
Internet Protocol Version 4, Src: 10.213.2.101, Dst: 10.213.2.1
Internet Control Message Protocol

No.     Time           Source                Destination           Protocol Length Info
      2 0.001155629    10.213.2.1            10.213.2.101          ICMP     100    Echo (ping) reply    id=0x2bea, seq=1/256, ttl=64 (request in 1)

Frame 2: 100 bytes on wire (800 bits), 100 bytes captured (800 bits) on interface 0
Linux cooked capture
Internet Protocol Version 4, Src: 10.213.2.1, Dst: 10.213.2.101
Internet Control Message Protocol

No.     Time           Source                Destination           Protocol Length Info
      3 1.000727427    10.213.2.101          10.213.2.1            ICMP     100    Echo (ping) request  id=0x2bea, seq=2/512, ttl=64 (reply in 4)

Frame 3: 100 bytes on wire (800 bits), 100 bytes captured (800 bits) on interface 0
Linux cooked capture
Internet Protocol Version 4, Src: 10.213.2.101, Dst: 10.213.2.1
Internet Control Message Protocol

No.     Time           Source                Destination           Protocol Length Info
      4 1.001812554    10.213.2.1            10.213.2.101          ICMP     100    Echo (ping) reply    id=0x2bea, seq=2/512, ttl=64 (request in 3)

Frame 4: 100 bytes on wire (800 bits), 100 bytes captured (800 bits) on interface 0
Linux cooked capture
Internet Protocol Version 4, Src: 10.213.2.1, Dst: 10.213.2.101
Internet Control Message Protocol

No.     Time           Source                Destination           Protocol Length Info
      5 2.001975277    10.213.2.101          10.213.2.1            ICMP     100    Echo (ping) request  id=0x2bea, seq=3/768, ttl=64 (reply in 6)

Frame 5: 100 bytes on wire (800 bits), 100 bytes captured (800 bits) on interface 0
Linux cooked capture
Internet Protocol Version 4, Src: 10.213.2.101, Dst: 10.213.2.1
Internet Control Message Protocol

No.     Time           Source                Destination           Protocol Length Info
      6 2.002644609    10.213.2.1            10.213.2.101          ICMP     100    Echo (ping) reply    id=0x2bea, seq=3/768, ttl=64 (request in 5)

Frame 6: 100 bytes on wire (800 bits), 100 bytes captured (800 bits) on interface 0
Linux cooked capture
Internet Protocol Version 4, Src: 10.213.2.1, Dst: 10.213.2.101
Internet Control Message Protocol

No.     Time           Source                Destination           Protocol Length Info
      7 3.016750183    10.213.2.101          10.213.2.1            ICMP     100    Echo (ping) request  id=0x2bea, seq=4/1024, ttl=64 (reply in 8)

Frame 7: 100 bytes on wire (800 bits), 100 bytes captured (800 bits) on interface 0
Linux cooked capture
Internet Protocol Version 4, Src: 10.213.2.101, Dst: 10.213.2.1
Internet Control Message Protocol

No.     Time           Source                Destination           Protocol Length Info
      8 3.017807641    10.213.2.1            10.213.2.101          ICMP     100    Echo (ping) reply    id=0x2bea, seq=4/1024, ttl=64 (request in 7)

Frame 8: 100 bytes on wire (800 bits), 100 bytes captured (800 bits) on interface 0
Linux cooked capture
Internet Protocol Version 4, Src: 10.213.2.1, Dst: 10.213.2.101
Internet Control Message Protocol

No.     Time           Source                Destination           Protocol Length Info
      9 4.018002713    10.213.2.101          10.213.2.1            ICMP     100    Echo (ping) request  id=0x2bea, seq=5/1280, ttl=64 (reply in 10)

Frame 9: 100 bytes on wire (800 bits), 100 bytes captured (800 bits) on interface 0
Linux cooked capture
Internet Protocol Version 4, Src: 10.213.2.101, Dst: 10.213.2.1
Internet Control Message Protocol

No.     Time           Source                Destination           Protocol Length Info
     10 4.018780975    10.213.2.1            10.213.2.101          ICMP     100    Echo (ping) reply    id=0x2bea, seq=5/1280, ttl=64 (request in 9)

Frame 10: 100 bytes on wire (800 bits), 100 bytes captured (800 bits) on interface 0
Linux cooked capture
Internet Protocol Version 4, Src: 10.213.2.1, Dst: 10.213.2.101
Internet Control Message Protocol

No.     Time           Source                Destination           Protocol Length Info
     11 5.032683490    10.213.2.101          10.213.2.1            ICMP     100    Echo (ping) request  id=0x2bea, seq=6/1536, ttl=64 (reply in 12)

Frame 11: 100 bytes on wire (800 bits), 100 bytes captured (800 bits) on interface 0
Linux cooked capture
Internet Protocol Version 4, Src: 10.213.2.101, Dst: 10.213.2.1
Internet Control Message Protocol

No.     Time           Source                Destination           Protocol Length Info
     12 5.033594181    10.213.2.1            10.213.2.101          ICMP     100    Echo (ping) reply    id=0x2bea, seq=6/1536, ttl=64 (request in 11)

Frame 12: 100 bytes on wire (800 bits), 100 bytes captured (800 bits) on interface 0
Linux cooked capture
Internet Protocol Version 4, Src: 10.213.2.1, Dst: 10.213.2.101
Internet Control Message Protocol

No.     Time           Source                Destination           Protocol Length Info
     13 7.036449366    10.213.2.101          10.255.255.204        TCP      76     47730 → 5309 [SYN] Seq=0 Win=29040 Len=0 MSS=1452 SACK_PERM=1 TSval=651798642 TSecr=0 WS=128

Frame 13: 76 bytes on wire (608 bits), 76 bytes captured (608 bits) on interface 0
Linux cooked capture
Internet Protocol Version 4, Src: 10.213.2.101, Dst: 10.255.255.204
Transmission Control Protocol, Src Port: 47730, Dst Port: 5309, Seq: 0, Len: 0

No.     Time           Source                Destination           Protocol Length Info
     14 8.040673223    10.213.2.101          10.255.255.204        TCP      76     [TCP Retransmission] 47730 → 5309 [SYN] Seq=0 Win=29040 Len=0 MSS=1452 SACK_PERM=1 TSval=651799646 TSecr=0 WS=128

Frame 14: 76 bytes on wire (608 bits), 76 bytes captured (608 bits) on interface 0
Linux cooked capture
Internet Protocol Version 4, Src: 10.213.2.101, Dst: 10.255.255.204
Transmission Control Protocol, Src Port: 47730, Dst Port: 5309, Seq: 0, Len: 0

No.     Time           Source                Destination           Protocol Length Info
     15 10.056702135   10.213.2.101          10.255.255.204        TCP      76     [TCP Retransmission] 47730 → 5309 [SYN] Seq=0 Win=29040 Len=0 MSS=1452 SACK_PERM=1 TSval=651801662 TSecr=0 WS=128

Frame 15: 76 bytes on wire (608 bits), 76 bytes captured (608 bits) on interface 0
Linux cooked capture
Internet Protocol Version 4, Src: 10.213.2.101, Dst: 10.255.255.204
Transmission Control Protocol, Src Port: 47730, Dst Port: 5309, Seq: 0, Len: 0

No.     Time           Source                Destination           Protocol Length Info
     16 14.316697702   10.213.2.101          10.255.255.204        TCP      76     [TCP Retransmission] 47730 → 5309 [SYN] Seq=0 Win=29040 Len=0 MSS=1452 SACK_PERM=1 TSval=651805922 TSecr=0 WS=128

Frame 16: 76 bytes on wire (608 bits), 76 bytes captured (608 bits) on interface 0
Linux cooked capture
Internet Protocol Version 4, Src: 10.213.2.101, Dst: 10.255.255.204
Transmission Control Protocol, Src Port: 47730, Dst Port: 5309, Seq: 0, Len: 0

No.     Time           Source                Destination           Protocol Length Info
     17 22.504689417   10.213.2.101          10.255.255.204        TCP      76     [TCP Retransmission] 47730 → 5309 [SYN] Seq=0 Win=29040 Len=0 MSS=1452 SACK_PERM=1 TSval=651814110 TSecr=0 WS=128

Frame 17: 76 bytes on wire (608 bits), 76 bytes captured (608 bits) on interface 0
Linux cooked capture
Internet Protocol Version 4, Src: 10.213.2.101, Dst: 10.255.255.204
Transmission Control Protocol, Src Port: 47730, Dst Port: 5309, Seq: 0, Len: 0

No.     Time           Source                Destination           Protocol Length Info
     18 37.143361207   10.213.2.101          10.255.255.204        TCP      76     47736 → 5309 [SYN] Seq=0 Win=29040 Len=0 MSS=1452 SACK_PERM=1 TSval=651828748 TSecr=0 WS=128

Frame 18: 76 bytes on wire (608 bits), 76 bytes captured (608 bits) on interface 0
Linux cooked capture
Internet Protocol Version 4, Src: 10.213.2.101, Dst: 10.255.255.204
Transmission Control Protocol, Src Port: 47736, Dst Port: 5309, Seq: 0, Len: 0

No.     Time           Source                Destination           Protocol Length Info
     19 38.156672996   10.213.2.101          10.255.255.204        TCP      76     [TCP Retransmission] 47736 → 5309 [SYN] Seq=0 Win=29040 Len=0 MSS=1452 SACK_PERM=1 TSval=651829762 TSecr=0 WS=128

Frame 19: 76 bytes on wire (608 bits), 76 bytes captured (608 bits) on interface 0
Linux cooked capture
Internet Protocol Version 4, Src: 10.213.2.101, Dst: 10.255.255.204
Transmission Control Protocol, Src Port: 47736, Dst Port: 5309, Seq: 0, Len: 0

No.     Time           Source                Destination           Protocol Length Info
     20 40.168655751   10.213.2.101          10.255.255.204        TCP      76     [TCP Retransmission] 47736 → 5309 [SYN] Seq=0 Win=29040 Len=0 MSS=1452 SACK_PERM=1 TSval=651831774 TSecr=0 WS=128

Frame 20: 76 bytes on wire (608 bits), 76 bytes captured (608 bits) on interface 0
Linux cooked capture
Internet Protocol Version 4, Src: 10.213.2.101, Dst: 10.255.255.204
Transmission Control Protocol, Src Port: 47736, Dst Port: 5309, Seq: 0, Len: 0

No.     Time           Source                Destination           Protocol Length Info
     21 44.264709527   10.213.2.101          10.255.255.204        TCP      76     [TCP Retransmission] 47736 → 5309 [SYN] Seq=0 Win=29040 Len=0 MSS=1452 SACK_PERM=1 TSval=651835870 TSecr=0 WS=128

Frame 21: 76 bytes on wire (608 bits), 76 bytes captured (608 bits) on interface 0
Linux cooked capture
Internet Protocol Version 4, Src: 10.213.2.101, Dst: 10.255.255.204
Transmission Control Protocol, Src Port: 47736, Dst Port: 5309, Seq: 0, Len: 0

No.     Time           Source                Destination           Protocol Length Info
     22 52.456701633   10.213.2.101          10.255.255.204        TCP      76     [TCP Retransmission] 47736 → 5309 [SYN] Seq=0 Win=29040 Len=0 MSS=1452 SACK_PERM=1 TSval=651844062 TSecr=0 WS=128

Frame 22: 76 bytes on wire (608 bits), 76 bytes captured (608 bits) on interface 0
Linux cooked capture
Internet Protocol Version 4, Src: 10.213.2.101, Dst: 10.255.255.204
Transmission Control Protocol, Src Port: 47736, Dst Port: 5309, Seq: 0, Len: 0

No.     Time           Source                Destination           Protocol Length Info
     23 68.075897290   10.213.2.101          10.255.255.204        TCP      76     53524 → 443 [SYN] Seq=0 Win=29040 Len=0 MSS=1452 SACK_PERM=1 TSval=651859681 TSecr=0 WS=128

Frame 23: 76 bytes on wire (608 bits), 76 bytes captured (608 bits) on interface 0
Linux cooked capture
Internet Protocol Version 4, Src: 10.213.2.101, Dst: 10.255.255.204
Transmission Control Protocol, Src Port: 53524, Dst Port: 443, Seq: 0, Len: 0

No.     Time           Source                Destination           Protocol Length Info
     24 69.096701181   10.213.2.101          10.255.255.204        TCP      76     [TCP Retransmission] 53524 → 443 [SYN] Seq=0 Win=29040 Len=0 MSS=1452 SACK_PERM=1 TSval=651860701 TSecr=0 WS=128

Frame 24: 76 bytes on wire (608 bits), 76 bytes captured (608 bits) on interface 0
Linux cooked capture
Internet Protocol Version 4, Src: 10.213.2.101, Dst: 10.255.255.204
Transmission Control Protocol, Src Port: 53524, Dst Port: 443, Seq: 0, Len: 0

No.     Time           Source                Destination           Protocol Length Info
     25 71.112654196   10.213.2.101          10.255.255.204        TCP      76     [TCP Retransmission] 53524 → 443 [SYN] Seq=0 Win=29040 Len=0 MSS=1452 SACK_PERM=1 TSval=651862717 TSecr=0 WS=128

Frame 25: 76 bytes on wire (608 bits), 76 bytes captured (608 bits) on interface 0
Linux cooked capture
Internet Protocol Version 4, Src: 10.213.2.101, Dst: 10.255.255.204
Transmission Control Protocol, Src Port: 53524, Dst Port: 443, Seq: 0, Len: 0

No.     Time           Source                Destination           Protocol Length Info
     26 75.240695527   10.213.2.101          10.255.255.204        TCP      76     [TCP Retransmission] 53524 → 443 [SYN] Seq=0 Win=29040 Len=0 MSS=1452 SACK_PERM=1 TSval=651866845 TSecr=0 WS=128

Frame 26: 76 bytes on wire (608 bits), 76 bytes captured (608 bits) on interface 0
Linux cooked capture
Internet Protocol Version 4, Src: 10.213.2.101, Dst: 10.255.255.204
Transmission Control Protocol, Src Port: 53524, Dst Port: 443, Seq: 0, Len: 0
